{
  "id": "indeed_8899e74afbc8",
  "title": "Gerente de loja",
  "company": "GT2RH",
  "location": "Redenção, PA, BR",
  "description": "Estamos em busca de um(a) Gerente de Loja para integrar o time de nosso cliente, líder na comercialização de jóias no atacado e no varejo, com atuação em todo o território nacional. Se você é apaixonado(a) por esse universo e possui experiência em vendas, gestão de pessoas e foco em resultados, esta pode ser a oportunidade ideal para você!\n\n**Principais Responsabilidades:**\n\n* Desenvolver e executar estratégias comerciais para alcance das metas da empresa;\n* Monitorar e analisar indicadores de desempenho de vendas, identificando oportunidades de melhoria;\n* Elaborar relatórios gerenciais e apresentações com resultados e análises da área;\n* Garantir o cumprimento dos processos de vendas e das políticas internas.\n* Liderar, desenvolver e acompanhar a equipe de vendas, promovendo treinamentos, orientações e feedbacks contínuos;\n* Atuar de forma integrada com áreas como Marketing, Financeiro e Recursos Humanos;\n* Acompanhar tendências de mercado e ações da concorrência, gerando insights para otimizar a performance da equipe.\n\n**Requisitos:**\n\n* Ensino superior completo ou cursando em áreas como Marketing, Administração, tecnólogo em gestão comercial ou áreas correlatas;\n* Conhecimento em técnicas de negociação e vendas;\n* Pacote office intermediário;\n* Flexibilidade de horários.\n\n**Pacote de Remuneração:**\n\n* Salário;\n* Comissão sobre produção;\n* Vale Refeição.\n\n**Expediente:**\n\n44 horas semanais de segunda a sexta\\-feira, das 8h30 às 17h30, com intervalo de 1 ( hora) para almoço, e aos sábados, das 9h às 13h.\n\nTipo de vaga: Efetivo CLT\n\nPagamento: R$2\\.500,00 \\- R$4\\.200,00 por mês\n\nBenefícios:\n\n* Vale\\-refeição\n\nLocal do trabalho: Presencial",
  "url": "https://br.indeed.com/viewjob?jk=e586f67082fbe8f8",
  "source": "indeed",
  "scraped_at": "2026-02-02T16:41:43.925415",
  "logo_url": NaN,
  "salary_info": "nan - nan nan",
  "applied": false,
  "resume_generated": false,
  "keywords": [
    "comerciais",
    "semanais",
    "principais",
    "performance",
    "marketing",
    "forma",
    "gerenciais",
    "local",
    "apaixonado",
    "metas",
    "processos",
    "estamos",
    "humanos",
    "feira",
    "comercial",
    "segunda",
    "treinamentos",
    "pacote",
    "flexibilidade",
    "resultados",
    "desenvolver",
    "foco",
    "oportunidades",
    "efetivo",
    "insights",
    "otimizar",
    "ensino",
    "internas",
    "conhecimento",
    "analisar",
    "melhoria",
    "promovendo",
    "garantir",
    "expediente",
    "clt",
    "oportunidade",
    "indicadores",
    "correlatas",
    "cursando",
    "feedbacks",
    "pessoas",
    "integrada",
    "pode",
    "desempenho",
    "esse",
    "vendas",
    "completo",
    "identificando",
    "ideal",
    "horas",
    "integrar",
    "monitorar",
    "cliente",
    "vaga",
    "universo",
    "time",
    "mercado",
    "sexta",
    "recursos",
    "alcance",
    "gerando",
    "financeiro",
    "responsabilidades",
    "empresa",
    "loja",
    "elaborar",
    "possui",
    "tipo",
    "cumprimento",
    "atacado",
    "executar",
    "superior",
    "busca",
    "gerente",
    "liderar",
    "vale",
    "hora",
    "equipe",
    "atuar",
    "pagamento",
    "intervalo",
    "presencial",
    "acompanhar",
    "nacional",
    "trabalho",
    "requisitos",
    "varejo",
    "office",
    "todo"
  ],
  "match_score": 0.43333333333333335,
  "matched_keywords": [
    "comerciais",
    "semanais",
    "principais",
    "performance",
    "marketing",
    "forma",
    "gerenciais",
    "local",
    "apaixonado",
    "metas",
    "processos"
  ],
  "missing_keywords": [
    "estamos",
    "humanos",
    "feira",
    "comercial",
    "segunda",
    "treinamentos",
    "pacote",
    "flexibilidade",
    "resultados",
    "desenvolver",
    "foco",
    "oportunidades",
    "efetivo",
    "insights",
    "otimizar",
    "ensino",
    "internas",
    "conhecimento",
    "analisar",
    "melhoria",
    "promovendo",
    "garantir",
    "expediente",
    "clt",
    "oportunidade",
    "indicadores",
    "correlatas",
    "cursando",
    "feedbacks",
    "pessoas",
    "integrada",
    "pode",
    "desempenho",
    "esse",
    "vendas",
    "completo",
    "identificando",
    "ideal",
    "horas",
    "integrar",
    "monitorar",
    "cliente",
    "vaga",
    "universo",
    "time",
    "mercado",
    "sexta",
    "recursos",
    "alcance",
    "gerando",
    "financeiro",
    "responsabilidades",
    "empresa",
    "loja",
    "elaborar",
    "possui",
    "tipo",
    "cumprimento",
    "atacado",
    "executar",
    "superior",
    "busca",
    "gerente",
    "liderar",
    "vale",
    "hora",
    "equipe",
    "atuar",
    "pagamento",
    "intervalo",
    "presencial",
    "acompanhar",
    "nacional",
    "trabalho",
    "requisitos",
    "varejo",
    "office",
    "todo"
  ]
}